{
  "$schema": "./schema/endgame.schema.json",
  "profile_version": "1.0.0",
  "canonical_skill": {
    "repository": "https://github.com/swl126/endgame",
    "version": "1.1.0",
    "commit": "2e08b3ee4751142648ed64608ac7d34f76c88637",
    "entrypoint": "SKILL.md"
  },
  "repository": "https://github.com/swl126/ai-skills",
  "repository_version": "4.0.0",
  "required_gates": [
    "catalog-valid",
    "proposal-backlog-valid",
    "embedded-skills-valid",
    "embedded-behavioral-tests-pass",
    "all-executable-engine-tests-pass",
    "unit-tests-pass",
    "local-links-resolve",
    "license-consistent",
    "privacy-boundary-preserved",
    "workflow-present",
    "remote-linked-skills-verified"
  ],
  "latest_audit": {
    "date": "2026-08-29",
    "result": "pass",
    "validated_skill_count": 2,
    "proposal_count": 20,
    "embedded_skill_count": 20,
    "test_count": 24
  }
}
